{
  "name": "Password Generator",
  "slug": "password-generator",
  "category": "🔐 Security Tools",
  "description": "Strong random passwords.",
  "keywords": [
    "Security",
    "Cryptography & Access"
  ],
  "inputs": [
    {
      "id": "inputData",
      "type": "text",
      "label": "Input Data"
    }
  ],
  "outputs": [
    {
      "id": "outputData",
      "type": "text",
      "label": "Output Result"
    }
  ],
  "supportedFormats": [
    "txt"
  ],
  "features": [
    "Fast and secure processing",
    "Works entirely in your browser",
    "No data is sent to the server"
  ],
  "faq": [
    {
      "question": "How to use Password Generator?",
      "answer": "Enter your input in the provided field and click process to generate the result."
    },
    {
      "question": "Is Password Generator free?",
      "answer": "Yes, completely free with no limits."
    }
  ],
  "seo": {
    "title": "Password Generator | Free Online Tool | SSDK TOOLS HUB",
    "description": "Use the best free online Password Generator. Strong random passwords."
  },
  "relatedTools": [],
  "version": "1.0.0"
}