{
  "name": "Differential WBC Analyzer",
  "slug": "differential-wbc-analyzer",
  "category": "🩺 Medical & Laboratory Tools",
  "description": "Analyze the complete differential White Blood Cell (WBC) count profile (Neutrophils, Lymphocytes, Monocytes, Eosinophils, Basophils).",
  "keywords": [
    "Medical  Laboratory",
    "Blood & CBC Panel"
  ],
  "inputs": [
    {
      "id": "inputData",
      "type": "text",
      "label": "Input Data"
    }
  ],
  "outputs": [
    {
      "id": "outputData",
      "type": "text",
      "label": "Output Result"
    }
  ],
  "supportedFormats": [
    "txt"
  ],
  "features": [
    "Fast and secure processing",
    "Works entirely in your browser",
    "No data is sent to the server"
  ],
  "faq": [
    {
      "question": "How to use Differential WBC Analyzer?",
      "answer": "Enter your input in the provided field and click process to generate the result."
    },
    {
      "question": "Is Differential WBC Analyzer free?",
      "answer": "Yes, completely free with no limits."
    }
  ],
  "seo": {
    "title": "Differential WBC Analyzer | Free Online Tool | SSDK TOOLS HUB",
    "description": "Use the best free online Differential WBC Analyzer. Analyze the complete differential White Blood Cell (WBC) count profile (Neutrophils, Lymphocytes, Monocytes, Eosinophils, Basophils)."
  },
  "relatedTools": [],
  "version": "1.0.0"
}