{
  "name": "Filename Sanitizer",
  "slug": "filename-sanitizer",
  "category": "🛡️ Privacy Tools",
  "description": "Secure, local Filename Sanitizer. Processes data securely directly in your browser.",
  "keywords": [
    "filename sanitizer",
    "privacy",
    "security",
    "privacy",
    "crypto",
    "free",
    "tool"
  ],
  "inputs": [
    {
      "id": "toolInput",
      "type": "textarea",
      "label": "Input Payload"
    }
  ],
  "outputs": [
    {
      "id": "toolOutput",
      "type": "textarea",
      "label": "Processed Output"
    }
  ],
  "supportedFormats": [
    "txt"
  ],
  "features": [
    "100% Client-Side Processing",
    "Web Crypto API Powered",
    "No data sent to servers",
    "Military-grade security implementations"
  ],
  "faq": [
    {
      "question": "Is the Filename Sanitizer safe to use for sensitive data?",
      "answer": "Yes. This tool runs entirely within your browser environment. Your sensitive data is never transmitted to our servers."
    },
    {
      "question": "How does it perform cryptographic operations?",
      "answer": "It leverages the native browser Web Crypto API (where applicable) to ensure secure, high-performance execution."
    },
    {
      "question": "Do I need to install any software?",
      "answer": "No. Everything operates strictly via your web browser."
    }
  ],
  "seo": {
    "title": "Filename Sanitizer | Enterprise Security & Privacy Tools | SSDK TOOLS HUB",
    "description": "Use the secure Filename Sanitizer. Guarantee your privacy with our 100% client-side cryptographic processing tools."
  },
  "relatedTools": [],
  "version": "1.0.0"
}