{
  "name": "Accessible Color Checker",
  "slug": "accessible-color-checker",
  "category": "🎨 Color Tools",
  "description": "Professional Accessible Color Checker for designers and developers. Execute tasks natively in your browser.",
  "keywords": [
    "accessible color checker",
    "color",
    "design",
    "color",
    "generator",
    "free",
    "tool"
  ],
  "inputs": [
    {
      "id": "toolInput",
      "type": "textarea",
      "label": "Input Configuration"
    }
  ],
  "outputs": [
    {
      "id": "toolOutput",
      "type": "textarea",
      "label": "Generated Code / Output"
    }
  ],
  "supportedFormats": [
    "txt",
    "css",
    "svg"
  ],
  "features": [
    "Zero Dependencies",
    "Real-time Browser Processing",
    "Responsive Interface",
    "Developer & Designer Friendly"
  ],
  "faq": [
    {
      "question": "Who is the Accessible Color Checker for?",
      "answer": "This tool is designed for web developers, UI/UX designers, and digital artists who need rapid, browser-based processing."
    },
    {
      "question": "Is my design data uploaded?",
      "answer": "No. All color calculations, CSS generation, and SVG optimizations are executed securely on your local device."
    },
    {
      "question": "Why is there no live visual canvas?",
      "answer": "If the tool is in 'Future Ready' mode, it means the advanced visual canvas rendering engine is pending integration."
    }
  ],
  "seo": {
    "title": "Accessible Color Checker | Enterprise Design & Color Tools | SSDK TOOLS HUB",
    "description": "Use the best free Accessible Color Checker. Instantly generate CSS, manage colors, and optimize designs."
  },
  "relatedTools": [],
  "version": "1.0.0"
}