{
  "name": "JSON Diff",
  "slug": "json-diff",
  "category": "👨‍💻 Developer Tools",
  "description": "Professional, free, and secure JSON Diff online. Developer utility for instant processing.",
  "keywords": [
    "json diff",
    "developer",
    "tool",
    "online",
    "free",
    "api"
  ],
  "inputs": [
    {
      "id": "toolInput",
      "type": "textarea",
      "label": "Input Data",
      "placeholder": "Paste your input here..."
    }
  ],
  "outputs": [
    {
      "id": "toolOutput",
      "type": "textarea",
      "label": "Output Result"
    }
  ],
  "supportedFormats": [
    "txt",
    "json",
    "xml",
    "csv",
    "yaml",
    "html",
    "css",
    "js"
  ],
  "features": [
    "Fast browser-side processing",
    "No data uploaded to server",
    "100% Secure and private",
    "Copy and Download instantly",
    "Responsive interface"
  ],
  "faq": [
    {
      "question": "How do I use the JSON Diff?",
      "answer": "Paste your data into the input field and the tool will automatically process it, or click the process button."
    },
    {
      "question": "Is the JSON Diff free?",
      "answer": "Yes, it is 100% free with no limits."
    },
    {
      "question": "Is my data secure?",
      "answer": "Absolutely. All processing happens entirely within your web browser. No data is sent to our servers."
    },
    {
      "question": "Does it work offline?",
      "answer": "Yes, this tool can function completely offline once the page is loaded."
    },
    {
      "question": "Can I use keyboard shortcuts?",
      "answer": "Yes, standard shortcuts like Ctrl+C for copying output are supported."
    }
  ],
  "seo": {
    "title": "JSON Diff | Free Secure Online Tool | SSDK TOOLS HUB",
    "description": "Use the best free online JSON Diff. Secure, private, and ultra-fast developer utility."
  },
  "relatedTools": [],
  "version": "1.0.0"
}