{
  "name": "Text Editor",
  "slug": "text-editor",
  "category": "📝 Text Tools",
  "description": "Free and secure online Text Editor. Fast browser-side processing for text and documents.",
  "keywords": [
    "text editor",
    "text",
    "free",
    "online",
    "converter",
    "generator"
  ],
  "inputs": [
    {
      "id": "toolInput",
      "type": "textarea",
      "label": "Input Text",
      "placeholder": "Enter text here..."
    }
  ],
  "outputs": [
    {
      "id": "toolOutput",
      "type": "textarea",
      "label": "Result"
    }
  ],
  "supportedFormats": [
    "txt"
  ],
  "features": [
    "Browser-side Execution",
    "No data uploaded to servers",
    "100% Secure & Private",
    "Instant Results"
  ],
  "faq": [
    {
      "question": "What is the Text Editor?",
      "answer": "The Text Editor helps you format, convert, or generate text and documents directly in your browser."
    },
    {
      "question": "Are my documents uploaded to a server?",
      "answer": "No. All text and document processing happens locally on your device for absolute privacy."
    },
    {
      "question": "Is it completely free?",
      "answer": "Yes, all our text utilities are entirely free to use without limits."
    }
  ],
  "seo": {
    "title": "Text Editor | Free Online Text & Document Tools | SSDK TOOLS HUB",
    "description": "Use the best free online Text Editor. Instantly convert and format text with absolute privacy."
  },
  "relatedTools": [],
  "version": "1.0.0"
}