{
  "name": "Specific Gravity Analyzer",
  "slug": "specific-gravity-analyzer",
  "category": "🩺 Medical & Laboratory Tools",
  "description": "Analyze urine specific gravity.",
  "keywords": ["Medical Laboratory", "Urine Analysis"],
  "inputs": [
    { "id": "sg", "type": "number", "label": "Specific Gravity" }
  ],
  "outputs": [
    { "id": "outputData", "type": "text", "label": "Analysis Result" }
  ],
  "supportedFormats": ["txt"],
  "features": ["Fast and secure processing", "Works entirely in your browser", "No data is sent to the server"],
  "faq": [],
  "seo": { "title": "Specific Gravity Analyzer | Free Online Tool | SSDK TOOLS HUB", "description": "Analyze urine specific gravity." },
  "relatedTools": [],
  "version": "1.0.0"
}