{
  "name": "MOV Converter",
  "slug": "mov-converter",
  "category": "🎬 Video Tools",
  "description": "Professional, private, and fast MOV Converter. Processes files securely directly in your browser.",
  "keywords": [
    "mov converter",
    "video",
    "free",
    "converter",
    "online",
    "ffmpeg"
  ],
  "inputs": [
    {
      "id": "fileInput",
      "type": "file",
      "label": "Upload File",
      "accept": "video/*"
    }
  ],
  "outputs": [
    {
      "id": "toolOutput",
      "type": "file",
      "label": "Processed File"
    }
  ],
  "supportedFormats": [
    "mp4",
    "webm",
    "mkv",
    "avi",
    "mov"
  ],
  "features": [
    "Client-Side Processing (FFmpeg WebAssembly)",
    "No data uploaded to servers",
    "100% Privacy Guaranteed",
    "Fast encoding and processing"
  ],
  "faq": [
    {
      "question": "What is the MOV Converter?",
      "answer": "The MOV Converter allows you to manipulate and process media files entirely in your browser."
    },
    {
      "question": "Are my files uploaded to your server?",
      "answer": "No. This tool utilizes advanced FFmpeg WebAssembly technology to process your files locally on your device."
    },
    {
      "question": "Why is the processing not starting?",
      "answer": "If the tool is in 'Future Ready' mode, it means the server requires specific Cross-Origin headers to enable WebAssembly. This will be activated soon."
    }
  ],
  "seo": {
    "title": "MOV Converter | Free Online Media Tools | SSDK TOOLS HUB",
    "description": "Use the best free online MOV Converter. Secure, private, and ultra-fast media processing directly in your browser."
  },
  "relatedTools": [],
  "version": "1.0.0"
}