{
  "name": "Body Surface Area",
  "slug": "body-surface-area",
  "category": "⚕️ Medical Tools",
  "description": "⚠️ MEDICAL DISCLAIMER: This Body Surface Area is for educational and informational purposes only. It is NOT a substitute for professional medical advice, diagnosis, or treatment.",
  "keywords": [
    "body surface area",
    "medical",
    "calculator",
    "nursing",
    "clinical",
    "health"
  ],
  "inputs": [
    {
      "id": "weight",
      "type": "number",
      "label": "Weight (kg)",
      "placeholder": "e.g., 70"
    },
    {
      "id": "height",
      "type": "number",
      "label": "Height (cm)",
      "placeholder": "e.g., 175"
    },
    {
      "id": "age",
      "type": "number",
      "label": "Age (years)",
      "placeholder": "e.g., 30"
    }
  ],
  "outputs": [
    {
      "id": "toolOutput",
      "type": "textarea",
      "label": "Clinical Result / Interpretation"
    }
  ],
  "supportedFormats": [
    "txt"
  ],
  "features": [
    "⚠️ FOR EDUCATIONAL PURPOSES ONLY",
    "Fast browser-side calculation",
    "No patient data uploaded to server",
    "100% HIPAA compliant (runs locally)",
    "Responsive clinical interface"
  ],
  "faq": [
    {
      "question": "What is the Body Surface Area?",
      "answer": "The Body Surface Area is an educational clinical tool designed to assist healthcare professionals and students in understanding medical calculations."
    },
    {
      "question": "Can I use this for real patient care?",
      "answer": "⚠️ NO. This tool is strictly for educational purposes and must not replace professional clinical judgment."
    },
    {
      "question": "Is patient data secure?",
      "answer": "Yes. This tool operates entirely within your web browser. No PHI (Protected Health Information) is ever transmitted to our servers."
    },
    {
      "question": "How are the results calculated?",
      "answer": "Results are based on standard clinical formulas taught in nursing and medical education."
    },
    {
      "question": "Does it work offline?",
      "answer": "Yes, once the page is loaded, the calculator functions completely offline."
    }
  ],
  "seo": {
    "title": "Body Surface Area | Free Medical & Nursing Calculator | SSDK TOOLS HUB",
    "description": "Use the free Body Surface Area for clinical education. ⚠️ For informational purposes only. Fast, private, and secure medical calculator."
  },
  "relatedTools": [],
  "version": "1.1.0"
}