{
  "name": "Sales Forecast Calculator",
  "slug": "sales-forecast-calculator",
  "category": "💼 Business Tools",
  "description": "Professional Sales Forecast Calculator. Instantly perform complex financial calculations in your browser.",
  "keywords": [
    "sales forecast calculator",
    "business",
    "finance",
    "business",
    "calculator",
    "free",
    "tool"
  ],
  "inputs": [
    {
      "id": "value1",
      "type": "number",
      "label": "Input Value 1",
      "defaultValue": 0
    },
    {
      "id": "value2",
      "type": "number",
      "label": "Input Value 2",
      "defaultValue": 0
    }
  ],
  "outputs": [
    {
      "id": "toolOutput",
      "type": "textarea",
      "label": "Calculation Result"
    }
  ],
  "supportedFormats": [
    "txt",
    "csv"
  ],
  "features": [
    "100% Client-Side Processing",
    "High Mathematical Precision",
    "Responsive Interface",
    "No data sent to servers"
  ],
  "faq": [
    {
      "question": "How accurate is the Sales Forecast Calculator?",
      "answer": "This tool utilizes high-precision native JavaScript mathematics to ensure accurate calculations."
    },
    {
      "question": "Is my financial data secure?",
      "answer": "Yes. All calculations are executed securely on your local device. No financial data is ever uploaded."
    },
    {
      "question": "Why are charts not displaying?",
      "answer": "If the tool is in 'Future Ready' mode, it means the advanced visualization engine (like Chart.js or PDF Export) is pending integration."
    }
  ],
  "seo": {
    "title": "Sales Forecast Calculator | Enterprise Business & Finance Tools | SSDK TOOLS HUB",
    "description": "Use the free Sales Forecast Calculator. Perform fast, secure, and accurate financial calculations instantly in your browser."
  },
  "relatedTools": [],
  "version": "1.0.0"
}